MCQ,choices,Correct
What term was coined by Arthur Samuel in 1959 to describe the field of computer gaming and artificial intelligence?,a:Artificial Intelligence|b:Machine Learning|c:Computer Gaming|d:Self-teaching Computers,b
"Who published the book 'The Organization of Behavior' in 1949, introducing a theoretical neural structure that influenced the development of machine learning?",a:Arthur Samuel|b:Donald Hebb|c:Walter Pitts|d:Warren McCulloch,b
What was the name of the experimental 'learning machine' developed by Raytheon Company in the early 1960s?,a:Cyberdyne|b:Cybernet|c:Cybertron|d:Cyberspace,c
"Who provided a formal definition of the algorithms studied in the machine learning field, emphasizing learning from experience and performance improvement?",a:Tom M. Mitchell|b:Alan Turing|c:Donald Hebb|d:Arthur Samuel,a
What are the two main objectives of modern-day machine learning as mentioned in the text?,a:To develop new computer programs|b:To predict future outcomes and classify data|c:To create artificial neural networks|d:To study human cognitive processes,b
